id,abstract
22,"While text mining and NLP research has been established for decades, there remain gaps in the literature that reports the use of these techniques in building real-world applications. For example, they typically look at single and sometimes simplified tasks, and do not discuss in-depth data heterogeneity and inconsistency that is common in real-world problems or their implication on the development of their methods. Also, few prior work has focused on the healthcare domain. In this work, we describe an industry project that developed text mining and NLP solutions to mine millions of heterogeneous, multilingual procurement documents in the healthcare sector. We extract structured procurement contract data that is used to power a platform for dynamically assessing supplier risks. Our work makes unique contributions in a number of ways. First, we deal with highly heterogeneous, multilingual data and we document our approach to tackle these challenges. This is mainly based on a method that effectively uses domain knowledge and generalises to multiple text mining and NLP tasks and languages. Second, applying this method to mine millions of procurement documents, we develop the first structured procurement contract database that will help facilitate the tendering process. Second, Finally, we discuss lessons learned for practical text mining/NLP development, and make recommendations for future research and practice."
23,"The dramatic increase in the number of microbe descriptions in databases, reports, and papers presents a two-fold challenge for accessing the information: integration of heterogeneous data in a standard ontology-based representation and normalization of the textual descriptions by semantic analysis. Recent text mining methods offer powerful ways to extract textual information and generate ontology-based representation. This paper describes the design of the Omnicrobe application that gathers comprehensive information on habitats, phenotypes, and usages of microbes from scientific sources of high interest to the microbiology community. The Omnicrobe database contains around 1 million descriptions of microbe properties. These descriptions are created by analyzing and combining six information sources of various kinds, i.e. biological resource catalogs, sequence databases and scientific literature. The microbe properties are indexed by the Ontobiotope ontology and their taxa are indexed by an extended version of the taxonomy maintained by the National Center for Biotechnology Information. The Omnicrobe application covers all domains of microbiology. With simple or rich ontology-based queries, it provides easy-to-use support in the resolution of scientific questions related to the habitats, phenotypes, and uses of microbes. We illustrate the potential of Omnicrobe with a use case from the food innovation domain."
24,"In the field of text classification, news text classification has always been the focus of research, and it is quite difficult. With the gradual maturity of deep learning technology and the advent of the information explosion era, the traditional text classification method has been unable to meet people's needs for rapid, efficient, and accurate news classification. The neural network based on bidirectional encoder representations from transformers (BERT) in deep learning is very suitable for news text classification. However, the random mask masking method adopted by BERT model does not incorporate the knowledge information of Chinese language, resulting in the problem of low classification accuracy. Based on this problem, this paper proposes a news topic classification method based on the ERNIE model of multi-stage fusion knowledge masking strategy. When the Chinese language knowledge information fusion model deals with the Chinese news text classification problem, the BERT model, BERT-CNN model, and ConvBERT model are compared. The results show that ERNIE model is superior to other models in the task of news text classification."
25,"This study investigates the possibilities offered by the development of graphene environment technology that can contribute to new and effective approaches for the transition to an ecologically benign ecosystem. To analyze the research and development progress in graphene environment technology, graphene environment technology research trends of South Korea for the years 2009–2020 are investigated by acquiring information pertaining to national research and development projects related to graphene environment technology from the National Science and Technology Information Service. Both structured and unstructured data are analyzed using diverse text-mining methods, such as keyword frequency analysis, association rule mining, and topic modelling. The results indicate that graphene research in South Korea is focused primarily on graphene use in batteries and energy-storage devices, such as solar cells, fuel cells, and secondary batteries. This study can help understand the manner by which the South Korean government has been investing in the research and development of graphene environment technology; additionally, it discusses the future applications and prospects of graphene for the next decade."
26,"In this paper, we propose DeepSumm, a novel method based on topic modeling and word embeddings for the extractive summarization of single documents. Recent summarization methods based on sequence networks fail to capture the long range semantics of the document which are encapsulated in the topic vectors of the document. In DeepSumm, our aim is to utilize the latent information in the document estimated via topic vectors and sequence networks to improve the quality and accuracy of the summarized text. Each sentence is encoded through two different recurrent neural networks based on probabilistic topic distributions and word embeddings, and then a sequence to sequence network is applied to each sentence encoding. The outputs of the encoder and the decoder in the sequence to sequence networks are combined after weighting using an attention mechanism and converted into a score through a multi-layer perceptron network. We refer to the score obtained through the topic model as Sentence Topic Score (STS) and to the score generated through word embeddings as Sentence Content Score (SCS). In addition, we propose Sentence Novelty Score (SNS) and Sentence Position Score (SPS) and perform a weighted fusion of the four scores for each sentence in the document to compute a Final Sentence Score (FSS). The proposed DeepSumm framework was evaluated on the standard DUC 2002 benchmark and CNN/DailyMail datasets. Experimentally, it was demonstrated that our method captures both the global and the local semantic information of the document and essentially outperforms existing state-of-the-art approaches for extractive text summarization with ROUGE-1, ROUGE-2, and ROUGE-L scores of 53.2, 28.7 and 49.2 on DUC 2002 and 43.3, 19.0 and 38.9 on CNN/DailyMail dataset."
27,"With recent advancements in the area of Natural Language Processing, the focus is slowly shifting from a purely English-centric view towards more language-specific solutions, including German. Especially practical for businesses to analyze their growing amount of textual data are text summarization systems, which transform long input documents into compressed and more digestible summary texts. In this work, we assess the particular landscape of German abstractive text summarization and investigate the reasons why practically useful solutions for abstractive text summarization are still absent in industry. Our focus is two-fold, analyzing a) training resources, and b) publicly available summarization systems. We are able to show that popular existing datasets exhibit crucial flaws in their assumptions about the original sources, which frequently leads to detrimental effects on system generalization and evaluation biases. We confirm that for the most popular training dataset, MLSUM, over 50% of the training set is unsuitable for abstractive summarization purposes. Furthermore, available systems frequently fail to compare to simple baselines, and ignore more effective and efficient extractive summarization approaches. We attribute poor evaluation quality to a variety of different factors, which are investigated in more detail in this work: A lack of qualitative (and diverse) gold data considered for training, understudied (and untreated) positional biases in some of the existing datasets, and the lack of easily accessible and streamlined pre-processing strategies or analysis tools. We provide a comprehensive assessment of available models on the cleaned datasets, and find that this can lead to a reduction of more than 20 ROUGE-1 points during evaluation."
28,"Due to the exponential increase in the generation of digital documents and in the online search user diversity, multilingual information is highly available on the Internet. However, the huge amount of multilingual data cannot be analyzed manually. Therefore, cross lingual multi-document summarization (CLMDS) model is introduced to generate a summary of several documents in which the summary language is different from the source document language. This paper presents a Deep Learning Enabled Cross-lingual Search with Metaheuristic based Query Optimization (DLCLS-MQO) model for Multi-document summarization. The DLCLS-MQO model allows to offer a query in Tamil, summarize several English documents, and lastly translate the summary into Tamil. The DLCLS-MQO model encompasses four stages of operation such as multilingual search, query optimization, automatic sematic lexicon builder, and document summarization. Firstly, bidirectional long short-term memory (BiLSTM) model is applied to perform multilingual searching process. Followed by, sunflower optimization (SFO) algorithm based query optimization process is carried out. Moreover, global vectors (GloVe) method is used for the construction of domain oriented sentiment lexicons. Finally, extreme gradient boosting (XGBoost) model is applied for the CLMDS. A detailed simulation analysis takes place to highlight the betterment of the DLCLS-MQO model. The resultant experimental values portrayed the superior performance of the DLCLS-MQO model over the compared methods."
29,"Text summarization on non-factoid question answering (NQA) aims at identifying the core information of redundant answer guidance using questions, which can dramatically improve answer readability and comprehensibility. Most existing approaches focus on extracting query-related sentences to construct a summary, where the logical connection of natural language and the hierarchical interpretable semantic association are often neglected, thus degrading performance. To address these issues, we propose a novel question-driven abstractive answer summarization model, called the Hierarchical Sliding Inference Generator (HSIG), to form inferable and interpretable summaries by explicitly introducing hierarchical information reasoning between questions and corresponding answers. Specifically, we first apply an elaborately designed hierarchical sliding fusion inference model to determine the most relevant question sentence-level representation that provides a deeper interpretable basis for sentence selection in summarization, which further increases computational performance on the premise of following the semantic inheritance structure. Additionally, to improve summary fluency, we construct a double-driven selective generator to integrate various semantic information from two mutual question-and-answer perspectives. Experimental results illustrate that compared with state-of-the-art baselines, our model achieves remarkable improvement on two benchmark datasets and specifically improves the 2.46 ROUGE-1 points on PubMedQA, which demonstrates the superiority of our model on abstractive summarization with hierarchical sequential reasoning."
30,"Abstractive Text Summarization (ATS), which is the task of constructing summary sentences by merging facts from different source sentences and condensing them into a shorter representation while preserving information content and overall meaning. It is very difficult and time consuming for human beings to manually summarize large documents of text. In this paper, we propose an LSTM-CNN based ATS framework (ATSDL) that can construct new sentences by exploring more fine-grained fragments than sentences, namely, semantic phrases. Different from existing abstraction based approaches, ATSDL is composed of two main stages, the first of which extracts phrases from source sentences and the second generates text summaries using deep learning. Experimental results on the datasets CNN and DailyMail show that our ATSDL framework outperforms the state-of-the-art models in terms of both semantics and syntactic structure, and achieves competitive results on manual linguistic quality evaluation."
